correctedspeciesname,catalognumber,n,dex,sin,%dex,%sin,island,correctedlocality,decimallatitudeUSE,decimallongitudeUSE,coordinateuncertaintyinMetersUSE
Auriculella ambusta,17016,3,,3,0,1,Oahu,"Waianae Mts.; Palehua; Maunuwai Valley, bottom of",21.381961,-158.099893,301
Auriculella ambusta,133825,6,,6,0,1,Oahu,Waianae Mountains; Kaloi = Palihua {=Palehua} Ridge between upper branches of Kaloi Gulch,21.388135,-158.097683,1454
Auriculella ambusta,133829,5,,5,0,1,Oahu,Waianae Mountains; Kaloi = Palehua; Von Holt place; top of ridge,21.388694,-158.097125,1311
Auriculella ambusta,59313,27,,27,0,1,Oahu,Waianae Mts.; Palehuaiki; S.W. slope,21.389138,-158.093866,1048
Auriculella ambusta,79662,1,,1,0,1,Oahu,Waianae Mts.; Palehuaiki,21.393667,-158.099629,719
Auriculella ambusta,16848,1,,1,0,1,Oahu,Waianae Mts.; Palehuaiki; near Green Peak,21.393846,-158.097997,534
Auriculella ambusta,183531,2,,2,0,1,Oahu,Waianae Mountains; Central Nanakuli,21.39436667,-158.1205667,
Auriculella ambusta,191500,9,6,3,0.666666667,0.333333333,Oahu,Waianae Mountains; Palehuaiki?,21.394986,-158.099286,2275
Auriculella ambusta,123420,14,,14,0,1,Oahu,Waianae Mountains; Kaloi Gulch 5>6; Palehua Loc. W490A-1,21.39586035,-158.0995361,100
Auriculella ambusta,123424,8,,8,0,1,Oahu,Waianae Mountains; Kaloi Gulch 5>6; Palehua Loc. W490A-1,21.39586035,-158.0995361,100
Auriculella ambusta,93052,4,1,3,0.25,0.75,Oahu,Waianae Mountains; Palehua,21.3958639,-158.0988083,
Auriculella ambusta,191489,5,,5,0,1,Oahu,Waianae Mountains; Palehua,21.3958639,-158.0988083,
Auriculella ambusta,186825,9,,9,0,1,Oahu,Waianae Mountains; Nanakuli,21.39639,-158.116774,3717
Auriculella ambusta,194403,3,,3,0,1,Oahu,Waianae Mountains; Nanakuli. Lot. 1228,21.39639,-158.116774,3717
Auriculella ambusta,"54069, 54081, 54130, 54148",21,0,21,0,1,Oahu,"Waianae Mts.; Nanakuli; NW of center, about 2nd valley E of Green Peak",21.3963944,-158.1284306,
Auriculella ambusta,132623,4,1,3,0.25,0.75,Oahu,"Waianae Mountains; Mauna Kapu to Palikea, along backbone",21.396644,-158.099142,1022
Auriculella ambusta,176455,34,,34,0,1,Oahu,Waianae Mountains; Manuwaikaalai Gulch; Loc. 5 = W470 A-1. SEE MAP,21.396761,-158.090903,73
Auriculella ambusta,128019,1,0,1,0,1,Oahu,Waianae Mountains; Nanakuli; Loc. 5 = W2-2c,21.397363,-158.107139,1983
Auriculella ambusta,33146,36,,36,0,1,Oahu,Waianae Mts.; Palehuaiki; lower part of valley back of,21.39764,-158.097222,408
Auriculella ambusta,33125,18,,18,0,1,Oahu,"Waianae Mts.; Palehua; Black Bull Valley, bottom of",21.399099,-158.103347,408
Auriculella ambusta,176419,1,,1,0,1,Oahu,Waianae Mountains; Manuwaikaalai Gulch; Loc. 3 = W470-7. SEE MAP,21.399594,-158.089896,100
Auriculella ambusta,16997,9,,9,0,1,Oahu,"Waianae Mts.; Palehua; Maunakapu, below = Loe W 470-2",21.401115,-158.098047,1101
Auriculella ambusta,176258,8,,8,0,1,Oahu,Waianae Mountains; Kaaikukai Gulch; Loc. 1a = w460 B-5. SEE MAP,21.401548,-158.090372,50
Auriculella ambusta,126802,15,,15,0,1,Oahu,Waianae Mountains; Kaaikukai; Loc. 4,21.402839,-158.081133,2295
Auriculella ambusta,210722,19,,19,0,1,Oahu,Waianae Mountains; Kaaikukai; Stream bed on Army Road; 1st branch south of main Kaaikukai Stream; Loc. 3,21.402839,-158.081133,2295
Auriculella ambusta,210773,15,,15,0,1,Oahu,Waianae Mountains; Kaaikukai; on Army Road; streambed; southernmost fork from Kaaikukai; Loc. 3,21.402839,-158.081133,2295
Auriculella ambusta,176375,33,,33,0,1,Oahu,Waianae Mountains; Kaaikukai Gulch; Loc. 1c = W460 B-3. SEE MAP,21.403397,-158.091164,50
Auriculella ambusta,177408,12,,12,0,1,Oahu,"Waianae Mountains; Kaaikukai Gulch; above Loc. 1 on a spur ridge, on side of trail; Loc. 2",21.403528,-158.081307,2911
Auriculella ambusta,177467,11,,11,0,1,Oahu,Waianae Mountains; Kaaikukai Gulch; above Loc. 2; Loc. 2a,21.403528,-158.081307,2911
Auriculella ambusta,210683,3,,3,0,1,Oahu,Waianae Mountains; Kaaikukai Gulch; on Army Road; 300 feet north of Loc. 2; Loc. 1,21.403528,-158.081307,2911
Auriculella ambusta,33180,9,,9,0,1,Oahu,"Waianae Mts.; Mauna Kapu, NE ridge of; from bottom-near top",21.4043911,-158.0978322,
Auriculella ambusta,165108,1,,1,0,1,Oahu,Waianae Mountains; South Kaaikukai; spur ridge below Mauna Kapu; Loc. 3 = W460B-6,21.40482016,-158.097584,100
Auriculella ambusta,123390,9,0,9,0,1,Oahu,Waianae Mountains; Nanakuli; Loc. WII-1 = W4-1,21.40483615,-158.0984207,100
Auriculella ambusta,127876,3,0,3,0,1,Oahu,Waianae Mountains; Nanakuli; Loc. 5 = W2-5a,21.405021,-158.108191,2915
Auriculella ambusta,126739,4,,4,0,1,Oahu,Waianae Mountains; Kaaikukai; Loc. 2,21.40511667,-158.0848667,
Auriculella ambusta,126751,2,,2,0,1,Oahu,Waianae Mountains; Kaaikukai; Loc. 3,21.40511667,-158.0848667,
Auriculella ambusta,53929,2,,2,0,1,Oahu,"Waianae Mts.; Nanakuli; head, about halfway up",21.4051806,-158.1125556,
Auriculella ambusta,182995,3,,3,0,1,Oahu,Waianae Mountains; Kaaikukai; inland 4 miles; Loc. 6. SEE MAP,21.405366,-158.093518,100
Auriculella ambusta,177060,6,,6,0,1,Oahu,"Waianae Mountains; North Kaaikukai; South fork, above Forest Reserve fence; Loc. 5 = W460-4. SEE MAP",21.405927,-158.090586,100
Auriculella ambusta,176313,18,,18,0,1,Oahu,Waianae Mountains; Kaaikukai Gulch; Loc. 1b = W460 B-4. SEE MAP,21.40631,-158.096494,97
Auriculella ambusta,127912,5,,5,0,1,Oahu,Waianae Mountains; Kaaikukai; Loc. 8 = W460 A-8,21.40660414,-158.0958218,100
Auriculella ambusta,177033,138,,138,0,1,Oahu,Waianae Mountains; North Kaaikukai; South branch above forest fence; Loc. 4 = W460-3. SEE MAP,21.406818,-158.089879,100
Auriculella ambusta,"182748, 182749, 182750",109,0,109,0,1,Oahu,Waianae Mountains; Nanakuli; inland 3-1/2 miles; Loc. 3. SEE MAP,21.406994,-158.102048,100
Auriculella ambusta,20189,40,,40,0,1,Oahu,Waianae Mts.; Mauna Kapu; below Kahuna Mt. (Mauna Kapu),21.4075,-158.1005556,
Auriculella ambusta,"172565, 172566, 172567",10,0,10,0,1,Oahu,Waianae Mountains; Nanakuli Valley; See map. Loc. 28,21.40751666,-158.1001333,
Auriculella ambusta,126728,7,,7,0,1,Oahu,Waianae Mountains; Kaaikukai>Nanakuli; Loc. 1 Map,21.407578,-158.098321,1954
Auriculella ambusta,"172622, 172623",2,0,2,0,1,Oahu,Waianae Mountains; Nanakuli Valley; See map. Loc. 29,21.40763334,-158.0990833,
Auriculella ambusta,"105781, 105782, 105823",14,0,14,0,1,Oahu,Waianae Mts.; Nanakuli (head of); small valley; side of foot of Cathedral Rock; Loc. = W2-2; Colony C,21.408314,-158.101527,100
Auriculella ambusta,"176971, 176972",66,0,66,0,1,Oahu,Waianae Mountains; North Kaaikukai; Loc. 3 = W460-2. SEE MAP,21.40840013,-158.0892329,100
Auriculella ambusta,123401,3,,3,0,1,Oahu,"Waianae Mountains; Above Kaikukai Gulch; Loc. W460A-6 = ""Mauka of Palehua""",21.4087591,-158.0984622,100
Auriculella ambusta,123409,7,,7,0,1,Oahu,"Waianae Mountains; Above Kaikukai Gulch; Loc. W460A-6 = ""Mauka of Palehua""",21.4087591,-158.0984622,100
Auriculella ambusta,123433,7,,7,0,1,Oahu,"Waianae Mountains; Palehua; ""Just North of 'Hole-in-rock""; #2 = Loc. 460A-6",21.4087591,-158.0984622,100
Auriculella ambusta,127990,10,0,10,0,1,Oahu,Waianae Mountains; Nanakuli; Loc. 4 = W5-2b,21.40898805,-158.1002691,100
Auriculella ambusta,176915,16,,16,0,1,Oahu,Waianae Mountains; North Kaaikukai Gulch; north branch. Above forest reserve fence; Loc. 2 = W460-1. SEE MAP,21.408999,-158.088272,100
Auriculella ambusta,"127813, 127814",10,0,10,0,1,Oahu,Waianae Mountains; Nanakuli; Loc. 3 = W5-2,21.40909332,-158.1006689,100
Auriculella ambusta,128086,3,0,3,0,1,Oahu,Waianae Mountains; Nanakuli; Loc. 6C = W5-5b,21.40916046,-158.0993274,100
Auriculella ambusta,"127862, 127863",8,0,8,0,1,Oahu,Waianae Mountains; Nanakuli; Loc. 4 = W5-2a,21.40950624,-158.1006601,100
Auriculella ambusta,"112760, 112761, 112763",10,0,10,0,1,Oahu,Waianae Mts.; Nanakuli; Loc. V; = W2-5a; Kaaikukai Forest Rangers Cabin,21.409581,-158.099247,100
Auriculella ambusta,186867,38,,38,0,1,Oahu,Waianae Mountains; Nanakuli Valley; head of valley,21.40978333,-158.1069167,
Auriculella ambusta,"183330, 183331, 183372",14,0,14,0,1,Oahu,Waianae Mountains; head of Nanakuli Valley; 1/2 mile North of Mauna Kapu; inland 2 miles +/-,21.4098,-158.1017,
Auriculella ambusta,127945,9,0,9,0,1,Oahu,Waianae Mountains; Loc. 3 = W5-3,21.40984631,-158.1003967,100
Auriculella ambusta,"105655, 105693",15,0,15,0,1,Oahu,Waianae Mts.; Nanakuli (head of); 100 feet below ridge; Loc. W2-4,21.410026,-158.103456,1336
Auriculella ambusta,105734,1,0,1,0,1,Oahu,Waianae Mts.; Nanakuli (head of); 300 feet below ridge; Loc. = W2-3; Colony B,21.410026,-158.103456,1336
Auriculella ambusta,59417,57,,57,0,1,Oahu,Waianae Mts.; Kupehau (=S. Palawai); at bottom 2nd valley E. of Green peak,21.41013333,-158.0893333,
Auriculella ambusta,59475,31,,31,0,1,Oahu,"Waianae Mountains; Ewa District; Kupehau (=S. Palawai), 2nd small val. E. of Green Pk., small pocket near bottom, under shallow talus",21.41013333,-158.0893333,
Auriculella ambusta,176877,1,,1,0,1,Oahu,Waianae Mountains; South Palawai Gulch; along trail; Loc. 1 = W425 B-1. SEE MAP,21.410274,-158.088168,100
Auriculella ambusta,128640,2,,2,0,1,Oahu,Waianae Mountains; Kupehau,21.410483,-158.092517,2218
Auriculella ambusta,133773,22,2,20,0.090909091,0.909090909,Oahu,"Waianae Mountains; Pepeolelo Kupehau Tunnel valley, North slope opposite forks",21.410483,-158.092517,2426
Auriculella ambusta,133807,13,5,8,0.384615385,0.615384615,Oahu,"Waianae Mountains; Pepeolelo Kupehau Tunnel valley, North slope, opposite forks",21.410483,-158.092517,2502
Auriculella ambusta,186897,2,,2,0,1,Oahu,Waianae Mountains; Kupehau,21.410483,-158.092517,2218
Auriculella ambusta,133776,9,,9,0,1,Oahu,Waianae Mountains; Pepeolelo Kupehau; first valley south of 2775' hill,21.41048333,-158.0925167,
Auriculella ambusta,"127786, 127787",20,1,19,0.05,0.95,Oahu,Waianae Mountains; Nanakuli; Loc. 2 = W5-6,21.41058694,-158.0995917,100
Auriculella ambusta,186924,34,34,,1,0,Oahu,Waianae Mountains; South of Palikea; main ridge; Loc. 2. SEE MAP,21.411247,-158.099536,200
Auriculella ambusta,186925,34,,34,0,1,Oahu,Waianae Mountains; South of Palikea; main ridge; Loc. 2. SEE MAP,21.411247,-158.099536,200
Auriculella ambusta,"105847, 105848",3,1,2,0.333333333,0.666666667,Oahu,Waianae Mts.; Loc. W450B-2; Colony D=38010-18,21.41140703,-158.0995766,100
Auriculella ambusta,174232,31,,31,0,1,Oahu,Waianae Mountains; Palawai I>II; along upper trail; Loc. 6 = W451 A-f5; See map,21.411493,-158.08615,101
Auriculella ambusta,180934,47,,47,0,1,Oahu,Waianae Mountains; South Palawai Gulch; Loc. 1 = 126823-892,21.41158333,-158.0977667,
Auriculella ambusta,211347,23,15,8,0.652173913,0.347826087,Oahu,Waianae Mountains; North Nanakuli; Hanging Valley,21.4116,-158.1072833,
Auriculella ambusta,183498,8,,8,0,1,Oahu,Waianae Mountains; Head of Nanakuli (North); two gullies North of trail,21.41173334,-158.1034833,
Auriculella ambusta,"128180, 128181",72,6,66,0.083333333,0.916666667,Oahu,Waianae Mountains; Nanakuli; Loc. 4 = W5-7,21.41182101,-158.1006881,100
Auriculella ambusta,123394,35,4,31,0.114285714,0.885714286,Oahu,"Waianae Mountains; Above Palawai Gulch; Loc. W450B-2 = Loc. W5-7, 7a & W450B-2; ""Main Ridge back of Palehua, 1st flat mauka of apex locality""",21.41182101,-158.1006881,100
Auriculella ambusta,"182869, 182870, 182871, 182872, 182899, 182900",654,35,619,0.05351682,0.94648318,Oahu,Waianae Mountains; Nanakuli; North Nanakuli; inland 3-1/2 miles; Loc. 4.; In overhanging valley. SEE MAP,21.411898,-158.100916,100
Auriculella ambusta,177092,33,,33,0,1,Oahu,"Waianae Mountains; South Palawai; north branch, near 3-mile mark; Loc. 7 = W452 B-3. SEE MAP 135076-100",21.411915,-158.089471,100
Auriculella ambusta,33017,25,,25,0,1,Oahu,Waianae Mts.; E; ridge S of Green Peak; head of small valley W of turn W,21.41193333,-158.1030833,
Auriculella ambusta,105878,2,2,,1,0,Oahu,"Waianae Mts.; Green Peak, North of saddle, in front of; Loc. W 450 B-3; Colony E=Loc. 21867-71",21.41215245,-158.0998131,100
Auriculella ambusta,128217,22,6,16,0.272727273,0.727272727,Oahu,Waianae Mountains; Palawai; Loc. 5 = W450 B-3,21.41215245,-158.0998131,100
Auriculella ambusta,"126874, 126876",65,0,65,0,1,Oahu,Waianae Mountains; Palawai; Loc. 6,21.412316,-158.092483,1758
Auriculella ambusta,127748,3,,3,0,1,Oahu,Waianae Mountains; Palawai; Loc. 8 = W451 B-7,21.412316,-158.092483,1758
Auriculella ambusta,24988,4,2,2,0.5,0.5,Oahu,"Waianae Mts.; Green Peak, E slope of",21.41249999,-158.0989833,
Auriculella ambusta,"105952, 105953, 105954",34,1,33,0.029411765,0.970588235,Oahu,Waianae Mountains; 3rd valley North of Saddle; Green Peak; foot of valley leading to top of Green Peak; Loc. W450 B-4; Colony F,21.41292456,-158.0998411,100
Auriculella ambusta,106018,19,3,16,0.157894737,0.842105263,Oahu,Waianae Mountains; 3rd valley North of Saddle; Green Peak; foot of valley leading to top of Green Peak; Loc. W450 B-4; Colony F,21.41292456,-158.0998411,100
Auriculella ambusta,106164,5,2,3,0.4,0.6,Oahu,Waianae Mountains; Colony F & G; Loc. W450 B-4 & 5,21.41292456,-158.0998411,100
Auriculella ambusta,165153,9,2,7,0.222222222,0.777777778,Oahu,Waianae Mountains; North > South Palawai; North slope; Loc. 2 = W451B-3,21.41321016,-158.0942272,100
Auriculella ambusta,174036,23,,23,0,1,Oahu,Waianae Mountains; North Palawai Gulch; Loc. 1 = W451 A-1; See map,21.41338,-158.084063,50
Auriculella ambusta,"106077, 106126",38,5,33,0.131578947,0.868421053,Oahu,Waianae Mountains; Colony G; about 200 feet above F; same valley; =Loc. W450 B-5,21.413428,-158.100251,100
Auriculella ambusta,16650,13,,13,0,1,Oahu,Waianae Mts.; Green Peak,21.413483,-158.101267,
Auriculella ambusta,21876,7,1,6,0.142857143,0.857142857,Oahu,"Waianae Mts.; Green Peak, top of",21.413483,-158.101267,
Auriculella ambusta,"59610, 59611",94,43,51,0.457446809,0.542553191,Oahu,Waianae Mountains; Green Pk; N. edge of ridge W. of Pk. to 1st ridge,21.41348334,-158.1028667,
Auriculella ambusta,106176,5,,5,0,1,Oahu,"Waianae Mountains; Colony H; subvalley, 200 yards North of Colony F; Loc. W450 B-6",21.413531,-158.100155,100
Auriculella ambusta,177216,9,,9,0,1,Oahu,Waianae Mountains; North Palawai; Loc. 11 = W451 A-8. SEE MAP 135076-100,21.413568,-158.092056,50
Auriculella ambusta,174080,11,,11,0,1,Oahu,Waianae Mountains; Palawai II; along trail in a small side gulch; Loc. 2 = W451 A-f2,21.413709,-158.084885,50
Auriculella ambusta,174140,15,,15,0,1,Oahu,"Waianae Mountains; Palawai II; above Loc. 2, under a large rock 20 feet above trail; Loc. 2a = W451 A-f2",21.413709,-158.084885,50
Auriculella ambusta,165163,7,4,3,0.571428571,0.428571429,Oahu,Waianae Mountains; North > South Palawai; North slope; Loc. 3 = W451B-4,21.4137865,-158.095426,100
Auriculella ambusta,127744,6,,6,0,1,Oahu,Waianae Mountains; Palawai; Loc. 7 = W451 B-6,21.41389749,-158.0989335,100
Auriculella ambusta,183861,8,,8,0,1,Oahu,Waianae Mountains; Palawai I>II; Loc. 5 = W451 B-1a. SEE MAP,21.41392,-158.097002,50
Auriculella ambusta,16533,61,2,59,0.032786885,0.967213115,Oahu,"Waianae Mts.; Palikea, under",21.413983,-158.101501,
Auriculella ambusta,165168,2,,2,0,1,Oahu,"Waianae Mountains; North > South Palawai; at steep rise of ridge where some huge rocks are on top of ridge, just below last high peak before Palikea; Loc. 4 = W451B-5; See original label",21.41404877,-158.0967525,100
Auriculella ambusta,174185,4,,4,0,1,Oahu,Waianae Mountains; Palawai I; along trail; Loc. 5 = W451 B-5; See map,21.41404877,-158.0967525,100
Auriculella ambusta,59530,2,1,1,0.5,0.5,Oahu,Waianae Mountains; Green Pk; 2 small valleys in front of Pk,21.414188,-158.099583,1282
Auriculella ambusta,21675,98,5,93,0.051020408,0.948979592,Oahu,Waianae Mts.; Palikea,21.4144,-158.100364,1807
Auriculella ambusta,59505,44,26,18,0.590909091,0.409090909,Oahu,"Waianae Mountains; Green Pk; 2 flats, valley in front of Pk",21.4144,-158.1003639,
Auriculella ambusta,59561,6,3,3,0.5,0.5,Oahu,Waianae Mountains; Green Pk; bottom small valley leading up to peak,21.4144,-158.1003639,
Auriculella ambusta,93313,6,,6,0,1,Oahu,Waianae Mts.; Palikea,21.4144,-158.100364,1807
Auriculella ambusta,164311,2,,2,0,1,Oahu,Waianae Mountains; Palikea,21.4144,-158.100364,1807
Auriculella ambusta,183412,87,,87,0,1,Oahu,Waianae Mountains; Palikea Region. SEE MAP,21.4144,-158.100364,1807
Auriculella ambusta,177745,12,,12,0,1,Oahu,Waianae Mountains; Palawai; Loc. 1 = W452-1. SEE MAP,21.414912,-158.08419,100
Auriculella ambusta,123358,5,,5,0,1,Oahu,"Waianae Mountains; Above Palawai II; Loc. W450A-1a; ""Loc. #6; North of Palikea""",21.415752,-158.100122,1849
Auriculella ambusta,22738,58,1,57,0.017241379,0.982758621,Oahu,Waianae Mts.; Green Peak; 1st gap,21.41596667,-158.0997,
Auriculella ambusta,"183464, 183465",121,6,115,0.049586777,0.950413223,Oahu,Waianae Mountains; Head of Nanakuli Valley,21.416134,-158.090826,1076
Auriculella ambusta,180959,3,,3,0,1,Oahu,Waianae Mountains; Palawai Gulch; Loc. 1 = 126823-892,21.416134,-158.090826,1076
Auriculella ambusta,127378,10,,10,0,1,Oahu,Waianae Mountains; Palawai; Loc. 4 = W450 A-1,21.41651462,-158.0954547,100
Auriculella ambusta,"127725, 127726",49,2,47,0.040816327,0.959183673,Oahu,Waianae Mountains; Palawai; Loc. 6 = W450 A-2 = W453 A-1,21.41680584,-158.0977677,100
Auriculella ambusta,127383,23,3,20,0.130434783,0.869565217,Oahu,Waianae Mountains; Palawai; Loc. 5 = W450 A-2,21.41680584,-158.0977677,100
Auriculella ambusta,165272,3,1,2,0.333333333,0.666666667,Oahu,"Waianae Mountains; North Palawai; south branch; north fork>Halona Palawai slope, north of gap; Loc. 5 = W452A-2",21.4169657,-158.0991809,100
Auriculella ambusta,127371,52,12,40,0.230769231,0.769230769,Oahu,Waianae Mountains; Palawai; Loc. 3 = W450-3,21.41720478,-158.0934381,100
Auriculella ambusta,127345,1,1,,1,0,Oahu,Waianae Mountains; Palawai; Loc. 2 = W450-2,21.41752681,-158.0926887,100
Auriculella ambusta,127490,34,13,21,0.382352941,0.617647059,Oahu,Waianae Mountains; Palawai; Loc. 11 = W450-4,21.41754356,-158.0941573,100
Auriculella ambusta,127316,2,,2,0,1,Oahu,Waianae Mountains; Palawai; Loc. 1 = W450-1; see map,21.417581,-158.091754,50
Auriculella ambusta,127389,3,,3,0,1,Oahu,Waianae Mountains; Palawai; Loc. 6 = W450-9,21.41801505,-158.0991512,100
Auriculella ambusta,127437,4,2,2,0.5,0.5,Oahu,Waianae Mountains; Palawai; Loc. 10 = W450-5,21.418281,-158.09441,50
Auriculella ambusta,127400,9,,9,0,1,Oahu,Waianae Mountains; Palawai; Loc. 7 = W450-8,21.41873297,-158.098813,100
Auriculella ambusta,33012,13,,13,0,1,Oahu,Waianae Mts.; E; ridge S of Green Peak; from 33002 - bottom of second Sewall's Leap. Loc 5 = W450-8-10-11,21.419253,-158.098307,100
Auriculella ambusta,127413,22,1,21,0.045454545,0.954545455,Oahu,Waianae Mountains; Palawai; Loc. 9 = W450-6,21.41925528,-158.0959681,100
Auriculella ambusta,177497,1,,1,0,1,Oahu,"Waianae Mountains; North Palawai>Halona; West slope, below Palikea; Loc. 6 =",21.4194,-158.1003,
Auriculella ambusta,"126927, 126928",48,1,47,0.020833333,0.979166667,Oahu,Waianae Mountains; Napepeolelo> Loc. W451-1 = Loc. 1 See map,21.41944879,-158.0918557,100
Auriculella ambusta,176844,1,,1,0,1,Oahu,Waianae Mountains; Napepeiauolelo Gulch; Loc. 15 = W440-1. SEE MAP,21.419464,-158.085928,50
Auriculella ambusta,127404,13,2,11,0.153846154,0.846153846,Oahu,Waianae Mountains; Palawai; Loc. 8 = W450-7,21.41964769,-158.0968305,100
Auriculella ambusta,127292,44,1,43,0.022727273,0.977272727,Oahu,Waianae Mountains; Napepeolelo>; Loc. 12 = W451-2,21.42006462,-158.0917266,100
Auriculella ambusta,"183384, 183385",3,1,2,0.333333333,0.666666667,Oahu,Waianae Mountains; Palawai > Napepeiauolelo,21.42027778,-158.0977778,7
Auriculella ambusta,126944,25,,25,0,1,Oahu,Waianae Mountains; Napepeolelo> Loc. W451-3 = Loc. 2,21.42028766,-158.0923032,100
Auriculella ambusta,177277,15,12,3,0.8,0.2,Oahu,Waianae Mountains; North Palawai; Loc. 14 = W451-3. SEE MAP 135076-100,21.42028766,-158.0923032,100
Auriculella ambusta,126978,9,4,5,0.444444444,0.555555556,Oahu,Waianae Mountains; Napepeolelo> Loc. W451-4 = Loc. 3,21.42056145,-158.0929127,100
Auriculella ambusta,127287,33,4,29,0.121212121,0.878787879,Oahu,Waianae Mountains; Napepeolelo>; Loc. 11 = W451-5,21.42081347,-158.0936171,100
Auriculella ambusta,175806,1,,1,0,1,Oahu,Waianae Mountains; Pualii; Loc. 1 = W430 C-4 (See map),21.420848,-158.080289,50
Auriculella ambusta,127057,48,,48,0,1,Oahu,Waianae Mountains; Napepeolelo> W; Loc. 4 = W440 A-1a,21.4209066,-158.0925062,100
Auriculella ambusta,127558,21,,21,0,1,Oahu,Waianae Mountains; Napepeolelo; Loc. 1 = W440 A-1a,21.4209066,-158.0925062,100
Auriculella ambusta,127280,22,,22,0,1,Oahu,Waianae Mountains; Napepeolelo>; Loc. 10 = W451-6,21.42094327,-158.0943352,100
Auriculella ambusta,177172,1,,1,0,1,Oahu,"Waianae Mountains; North Palawai; along contour trail, just north of Loc. W451-5; Loc. 9 = W451 A-6. SEE MAP 135076-100",21.421004,-158.094018,50
Auriculella ambusta,126034,5,,5,0,1,Oahu,"Waianae Mountains; Pualii, Valley I, Gulch III; Loc. 3 = W420 B-2",21.421065,-158.088885,1896
Auriculella ambusta,175846,7,,7,0,1,Oahu,Waianae Mountains; Pualii; Loc. 2 = W430 C-3 (See map),21.421091,-158.080224,50
Auriculella ambusta,113227,1,,1,0,1,Oahu,Waianae Mountains; Halona; Loc. V,21.421108,-158.10448,50
Auriculella ambusta,127138,90,,90,0,1,Oahu,Waianae Mountains; Napepeolelo> W; Loc. 5 = W440 A-1,21.42121342,-158.0922109,100
Auriculella ambusta,127219,143,,143,0,1,Oahu,Waianae Mountains; Napepeolelo> W; Loc. 6 = W440 A-2,21.42134048,-158.093034,100
Auriculella ambusta,127634,36,,36,0,1,Oahu,Waianae Mountains; Napepeolelo; Loc. 3 = W440 A-2a,21.4214204,-158.0926376,100
Auriculella ambusta,113187,4,,4,0,1,Oahu,Waianae Mts.; Lualualei; Halona; Loc. II,21.421454,-158.10616,50
Auriculella ambusta,127264,5,,5,0,1,Oahu,Waianae Mountains; Napepeolelo; Loc. 9 = W440 A-3a,21.421488,-158.094372,50
Auriculella ambusta,184884,4,,4,0,1,Oahu,Waianae Mountains; Pualii; 5 & 6; along new firebreak trail,21.421544,-158.088499,1875
Auriculella ambusta,165286,1,,1,0,1,Oahu,Waianae Mountains; Pualii Gulch 4>Napepeiauolelo>Halona; Pualii slope; Loc. 11 = W441-2,21.421584,-158.090945,1619
Auriculella ambusta,173922,2,,2,0,1,Oahu,Waianae Mountains; Near head of Napepeolelo Gulch; Loc. = Meinecke's Loc. 445 of 25/III/34; See # 126998-127164,21.42188333,-158.0935667,
Auriculella ambusta,173978,166,,166,0,1,Oahu,Waianae Mountains; Near head of Napepeolelo Gulch; Loc. = 126998-127164; Sweeping stored,21.42188333,-158.0935667,
Auriculella ambusta,123383,34,,34,0,1,Oahu,Waianae Mountains; Loc. W440A; Above Napepeolelo & Palawai; Valley III = W440A-4 to W540-7b;,21.42302785,-158.0937101,100
Auriculella ambusta,176765,16,,16,0,1,Oahu,Waianae Mountains; Pualii Gulch; Loc. 9 = W430 B-1. SEE MAP,21.42361878,-158.0826392,100
Auriculella ambusta,165292,6,,6,0,1,Oahu,Waianae Mountains; Pualii Gulch 4&5>Halona; south slope; Loc. 12 = W431-1,21.42379078,-158.0927358,100
Auriculella ambusta,165300,10,,10,0,1,Oahu,Waianae Mountains; Pualii Gulch 4>5; North slope & Top of ridge; Loc. 15 = W431-3,21.42388168,-158.0911561,100
Auriculella ambusta,176714,1,,1,0,1,Oahu,Waianae Mountains; Pualii Gulch; Loc. 8 = W430 A-2. SEE MAP,21.424733,-158.083674,100
Auriculella ambusta,176691,5,,5,0,1,Oahu,Waianae Mountains; Pualii Gulch; Loc. 7 = W430-3. SEE MAP,21.426088,-158.084952,100
Auriculella ambusta,176650,26,,26,0,1,Oahu,Waianae Mountains; Pualii Gulch; Loc. 6 = W430-2. SEE MAP = 135009-011,21.42648891,-158.0849043,100
Auriculella ambusta,176595,3,,3,0,1,Oahu,Waianae Mountains; Pohakea Gulch; Loc. 4 = W425-1. SEE MAP for #135001-020,21.427453,-158.086909,200
Auriculella ambusta,183765,2,,2,0,1,Oahu,Waianae Mountains; Pohakea Pass; at foot of cliffs; Loc. 1a. SEE MAP,21.429359,-158.08991,100
Auriculella ambusta,"211433, 211468, 211469",177,21,156,0.118644068,0.881355932,Oahu,Waianae Mountains; Ekahanui Gulch; Loc. 2,21.440196,-158.090178,75
Auriculella ambusta,113262,9,,9,0,1,Oahu,Waianae Mts.; Lualualei; Halona; Loc. VII; =W10A-7,21.429924,-158.099943,1184
Auriculella ambusta,34089,9,,9,0,1,Oahu,Waianae Mts.; Lihue; 1st ravine W of Pohakea Gap,21.4301,-158.0917,
Auriculella ambusta,180883,3,,3,0,1,Oahu,"Waianae Mountains; Pohakea Pass (= Pualii); south side, on cut for new fire break trail. Additional soil in storage",21.430531,-158.091586,880
Auriculella ambusta,125951,9,9,,1,0,Oahu,Waianae Mountains; Pualii>Ekahanui; Loc. 6 = W420-6,21.432981,-158.083601,2898
Auriculella ambusta,176555,3,,3,0,1,Oahu,Waianae Mountains; Puumaialau Gulch; Loc. 3 = W424-2. SEE MAP for #135001-020,21.43307,-158.087513,50
Auriculella ambusta,176518,1,,1,0,1,Oahu,Waianae Mountains; Puumaialau Gulch; Loc. 2 = W424-1. SEE MAP for #135001-020,21.434915,-158.086912,100
Auriculella ambusta,"211767, 211810",11,0,11,0,1,Oahu,Waianae Mountains; Puumaialau Gulch; Loc. 8,21.436618,-158.089419,117
Auriculella ambusta,125964,1,,1,0,1,Oahu,Waianae Mountains; Pualii; Valley I>II; Gulch V; Loc. 10 = W420 A-1,21.43735364,-158.0889814,100
Auriculella ambusta,125946,10,5,5,0.5,0.5,Oahu,Waianae Mountains; Pualii>Ekahanui; Loc. 5 = W420-3,21.43762069,-158.0919526,100
Auriculella ambusta,125942,18,6,12,0.333333333,0.666666667,Oahu,Waianae Mountains; Pualii>Ekahanui; Loc. 4 = W410 F-8,21.43766438,-158.0929804,100
Auriculella ambusta,"113712, 113713, 113715",19,0,19,0,1,Oahu,Waianae Mountains; Central Lualualei; below Kaua; valley 6; above precipice,21.43796,-158.115076,2468
Auriculella ambusta,"113676, 113677, 113680",14,1,13,0.071428571,0.928571429,Oahu,Waianae Mountains; Central Lualualei; below Kaua; valleys 5; Loc. 6; above precipice,21.43796,-158.115076,2468
Auriculella ambusta,"113471, 113474",4,2,2,0.5,0.5,Oahu,Waianae District; Waianae Mountains; Central Lualualei; below Kaua; at the head of Valley 3; Loc. VII; below precipice,21.43796,-158.115076,2468
Auriculella ambusta,113597,1,,1,0,1,Oahu,Waianae Mountains; Central Lualualei; below Kaua; Loc. 4; valley 5; below the 1st percipice,21.43796,-158.115076,2468
Auriculella ambusta,"125909, 125911",37,13,24,0.351351351,0.648648649,Oahu,Waianae Mountains; Ekahanui; Valley I; Loc. 3 = W410 F-6,21.43820084,-158.0918776,100
