correctedspeciesname,catalognumber,n,dex,sin,%dex,%sin,island,correctedlocality,decimallatitudeUSE,decimallongitudeUSE,coordinateuncertaintyinMetersUSE
Auriculella diaphana,120747,13,,13,0,1,Oahu,Koolau Mountains; Pacific Heights Ridge; mauka of vittata loc. On Nuuanu slope; Loc. 93A,21.33800845,-157.8240444,100
Auriculella diaphana,56887,2,0,2,0,1,Oahu,Niu; ridge betw. Niu valleys; high up on ridge,21.3384,-157.823494,4622
Auriculella diaphana,"34058, 34065",106,0,106,0,1,Oahu,Pauoa; E; Castle trail; mauka portion,21.338437,-157.812971,1185
Auriculella diaphana,17384,14,,14,0,1,Oahu,Tantalus; Pauoa side; Castle trail; just above W.R. Castle's,21.338437,-157.812971,1185
Auriculella diaphana,49055,22,,22,0,1,Oahu,"Pauoa; along Castle trail, between Pauoa flats and Castle house",21.338437,-157.812971,1185
Auriculella diaphana,58721,42,0,42,0,1,Oahu,Tantalus; from beginning of Castle trail & rest house to back of bowl & along W rim,21.338437,-157.812971,1185
Auriculella diaphana,58760,322,0,322,0,1,Oahu,Tantalus; Pauoa slope 5th gully above saddle on Castle trail.,21.338437,-157.812971,1185
Auriculella diaphana,215559,335,0,335,0,1,Oahu,Pauoa; along Castle Trail,21.338437,-157.812971,1185
Auriculella diaphana,189022,4,0,4,0,1,Oahu,Palolo; spur of Manoa>Palolo,21.3386111,-157.7911111,
Auriculella diaphana,15714,14,5,9,0.357142857,0.642857143,Oahu,Pauoa; lower part of flat above kukui trees,21.339789,-157.815042,
Auriculella diaphana,120758,28,1,27,0.035714286,0.964285714,Oahu,Pauoa Flats; Loc. 95,21.339789,-157.8150415,
Auriculella diaphana,"23009, 23010, 23011",30,3,27,0.1,0.9,Oahu,Nuuanu-Palolo trail; gap head of Manoa between Konahuanui & Olympus,21.34024929,-157.7857666,
Auriculella diaphana,45994,29,0,29,0,1,Oahu,Manoa; head of valley near stream,21.3407852,-157.799559,
Auriculella diaphana,46023,14,0,14,0,1,Oahu,Manoa; head of valley,21.3407852,-157.799559,
Auriculella diaphana,"162329, 162337",3,0,3,0,1,Oahu,Koolau Mountains; Pacific Heights Ridge; see map,21.34086667,-157.82255,
Auriculella diaphana,120679,108,,108,0,1,Oahu,Tantalus; west slope above Pauoa Flats; side hill trail (Mauka); Loc. 91,21.341148,-157.808519,1745
Auriculella diaphana,52140,65,1,64,0.015384615,0.984615385,Oahu,Kapalama,21.34206,-157.855081,3764
Auriculella diaphana,54289,5,,5,0,1,Oahu,Kapalama,21.34206,-157.855081,3764
Auriculella diaphana,93582,1,0,1,0,1,Oahu,Manoa; Waihinui Valley,21.342157,-157.799268,739
Auriculella diaphana,24902,31,,31,0,1,Oahu,Pauoa; E side,21.34302768,-157.8117808,
Auriculella diaphana,24906,78,,78,0,1,Oahu,Pauoa; E side,21.34302768,-157.8117808,
Auriculella diaphana,24911,6,1,5,0.166666667,0.833333333,Oahu,Pauoa; E side; on ridge,21.34302768,-157.8117808,
Auriculella diaphana,24916,31,,31,0,1,Oahu,Pauoa; E side,21.34302768,-157.8117808,
Auriculella diaphana,57009,1,,1,0,1,Oahu,"Pauoa, head of",21.34502663,-157.8040776,
Auriculella diaphana,25026,5,0,5,0,1,Oahu,Nuuanu; Nuuanu Valley,21.35001597,-157.8168689,
Auriculella diaphana,40454,18,1,17,0.055555556,0.944444444,Oahu,"Kalihi; Kamanaiki, lower; above old shack",21.35016666,-157.8509,
Auriculella diaphana,41153,7,,7,0,1,Oahu,"Kalihi; Kamanaiki; 1st valley going in towards Nuuanu, after passing old shack",21.350173,-157.85079,
Auriculella diaphana,88743,1,0,1,0,1,Oahu,"Konahuanui, SW side of",21.350672,-157.79058,806
Auriculella diaphana,103052,11,,11,0,1,Oahu,Kapalama-Kamanaiki Ridge,21.352133,-157.841532,2947
Auriculella diaphana,134042,8,,8,0,1,Oahu,"Kapalama; east branch, near top",21.352603,-157.834902,1152
Auriculella diaphana,21757,1,0,1,0,1,Oahu,Konahuanui ridge; 4th ridge of Olympus trail,21.353369,-157.788918,2469
Auriculella diaphana,47169,10,0,10,0,1,Oahu,"Palolo; W branch, W road",21.353622,-157.83458,1152
Auriculella diaphana,103064,8,2,6,0.25,0.75,Oahu,Kalihi; Kamanaiki; west side of valley; makai,21.353693,-157.846053,2781
Auriculella diaphana,"162300, 162301",6,0,6,0,1,Oahu,Kapalama Ridge; inland 3 miles,21.35384999,-157.8323167,
Auriculella diaphana,184097,14,2,12,0.142857143,0.857142857,Oahu,Kapalama Ridge; inland 3 miles,21.35384999,-157.8323167,
Auriculella diaphana,120877,12,,12,0,1,Oahu,Keanakamano; Loc. 110,21.35393825,-157.830931,100
Auriculella diaphana,"35394, 35395",102,3,99,0.029411765,0.970588235,Oahu,Kalihi; Kamanaiki Valley; bottom of valley; above uppermost fence,21.35411,-157.845993,2820
Auriculella diaphana,34788,9,,9,0,1,Oahu,"Kalihi; Kamanaiki-Kapalama ridge; Kamanaiki side, near top",21.354525,-157.835957,3612
Auriculella diaphana,183678,1,0,1,0,1,Oahu,Konahuanui Ridge,21.355136,-157.787875,820
Auriculella diaphana,35223,1,,1,0,1,Oahu,"Kalihi; Kamanaiki Valley East ridge, above 35221",21.355157,-157.834125,3790
Auriculella diaphana,103054,5,,5,0,1,Oahu,"Kalihi; Kamanaiki Valley; east side, makai",21.355441,-157.83775,2489
Auriculella diaphana,103055,18,0,18,0,1,Oahu,Kalihi; Kamanaiki Valley; east side,21.355922,-157.837686,2102
Auriculella diaphana,103056,2,0,2,0,1,Oahu,Kalihi; Kamanaiki Valley; east side,21.355922,-157.837686,2102
Auriculella diaphana,34784,5,,5,0,1,Oahu,Kalihi; Kamanaiki Valley; lower limit of shells,21.356218,-157.837666,3030
Auriculella diaphana,34794,24,1,23,0.041666667,0.958333333,Oahu,Kalihi; Kamanaiki Valley; just above mauka fence,21.356562,-157.837922,1943
Auriculella diaphana,103043,15,,15,0,1,Oahu,Makiki-Pauoa Ridge,21.357482,-157.810502,1410
Auriculella diaphana,"93493, 93494",16,0,16,0,1,Oahu,Kahauiki-Kalihi; #7,21.357526,-157.856688,5208
Auriculella diaphana,35375,8,,8,0,1,Oahu,Kalihi; Kamanaiki Valley; East side; top of ridge-near bottom of valley,21.358449,-157.833565,2771
Auriculella diaphana,103053,23,0,23,0,1,Oahu,"Kalihi; Kamanaiki Valley; mauka end of path, east side of stream",21.358619,-157.833075,4108
Auriculella diaphana,17935,7,,7,0,1,Oahu,Kahauiki,21.35879451,-157.8689277,
Auriculella diaphana,20830,15,,15,0,1,Oahu,Kahauiki,21.35879451,-157.8689277,
Auriculella diaphana,41890,13,,13,0,1,Oahu,Kahauiki,21.35879451,-157.8689277,
Auriculella diaphana,90186,3,,3,0,1,Oahu,Kalihi; Kalihi Valley,21.35962366,-157.8380696,
Auriculella diaphana,41904,1,,1,0,1,Oahu,Kalihi; Kamanaiki,21.363516,-157.847268,1709
Auriculella diaphana,128982,1,0,1,0,1,Oahu,Kailua; Loc. 760-3 = Loc. #3; At very base of pali,21.363756,-157.784667,1873
Auriculella diaphana,34033,88,13,75,0.147727273,0.852272727,Oahu,Kalihi; West side; about 12 mile above Gay's,21.3652778,-157.8438889,
Auriculella diaphana,103058,3,,3,0,1,Oahu,Kalihi; west side; opposite water meter; mauka edge,21.365278,-157.843889,1605
Auriculella diaphana,"90162, 90163, 90164",6,0,6,0,1,Oahu,"Kalihi; Kalihi Valley; rt., 3/4 up valley just above cliff",21.365883,-157.83717,4856
Auriculella diaphana,103060,12,,12,0,1,Oahu,Kahauiki-Moanalua Ridge,21.365934,-157.862942,3256
Auriculella diaphana,51430,1,,1,0,1,Oahu,Kalihi; right side,21.366243,-157.83129,5564
Auriculella diaphana,45768,4,,4,0,1,Oahu,"Honolulu District; Kalihi; mauka edge banana field, W of Govt. water meter in Kalihi Stream, mauka side of small valley",21.366433,-157.835517,
Auriculella diaphana,45759,1,,1,0,1,Oahu,"Kalihi; side of valley, above large banana field; West of Govt. water meter in Kalihi Stream",21.36648,-157.840512,
Auriculella diaphana,167781,12,1,11,0.083333333,0.916666667,Oahu,Kahauiki>Kalihi; = lot 93480-487,21.366715,-157.852754,3851
Auriculella diaphana,167783,2,,2,0,1,Oahu,Kahauiki>Kalihi; = lot 934888-494,21.366715,-157.852754,3851
Auriculella diaphana,194736,3,,3,0,1,Oahu,Kahauiki>Manaiki; Loc. 1. MAP,21.366974,-157.86211,3493
Auriculella diaphana,44533,1,,1,0,1,Oahu,"Koolau Mountains; Moanalua-Kahauiki ridge, about 1/4 mi., or less, mauka of the makai limit of the woods on that ridge",21.367577,-157.861276,2856
Auriculella diaphana,103059,75,10,65,0.133333333,0.866666667,Oahu,Kalihi; west side; on sharp ridge,21.367811,-157.850499,4376
Auriculella diaphana,120963,33,,33,0,1,Oahu,Kahauiki; Loc. #3; (Kahauiki>Manaiki); Loc. 152,21.368289,-157.858475,3597
Auriculella diaphana,"90175, 90176, 90177",21,0,21,0,1,Oahu,"Kalihi; Kalihi Valley; left side, 1/8 mile past cliff-200 ft. above trail",21.368791,-157.827129,4215
Auriculella diaphana,103057,2,1,1,0.5,0.5,Oahu,Kalihi; ridge on west side,21.369118,-157.847646,3109
Auriculella diaphana,45963,1,,1,0,1,Oahu,Kalihi; on ridge above Govt. water meter,21.36995,-157.836032,2742
Auriculella diaphana,19584,3,,3,0,1,Oahu,Lanihuli,21.3703452,-157.8103852,
Auriculella diaphana,"42142, 42149",6,0,6,0,1,Oahu,"Maunaloa #1, E side of valley above 1st waterfall",21.375858,-157.872799,5523
Auriculella diaphana,"180685, 180686, 180687",40,0,40,0,1,Oahu,Kalihi>Manaiki; Loc. 3. SEE MAP,21.384307,-157.824618,200
Auriculella diaphana,"180816, 180818",27,0,27,0,1,Oahu,Kalihi>Manaiki; Loc. 2; SEE MAP,21.384612,-157.824803,200
Auriculella diaphana,41322,79,0,79,0,1,Oahu,Mauna Kope,21.3850194,-157.8238139,
Auriculella diaphana,51438,184,0,184,0,1,Oahu,Mauna Kope,21.3850194,-157.8238139,
Auriculella diaphana,17772,20,,20,0,1,Oahu,Halawa,21.38521271,-157.8903115,
Auriculella diaphana,216102,6,0,6,0,1,Oahu,Halawa,21.38521271,-157.8903115,
Auriculella diaphana,41111,28,0,28,0,1,Oahu,Mauna Kope; center of plateau,21.385297,-157.82379,1119
Auriculella diaphana,75478,17,,17,0,1,Oahu,Halawa Valley; 3/4 mi. above forest reserve line,21.401233,-157.878367,4545
Auriculella diaphana,21555,2,,2,0,1,Oahu,Waiamano,21.429808,-157.93004,6790
Auriculella diaphana,103061,4,,4,0,1,Oahu,Waiawa; west side; gulch by ditch trail,21.458056,-157.946944,14542
Auriculella expansa,"45437, 45439, 45441, 45445",12,0,12,0,1,Maui,West Maui; Honokahau,20.821466,-156.485642,250
Auriculella expansa,25047,22,1,21,0.045454545,0.954545455,Maui,West Maui; Honokahau,20.821466,-156.485642,250
Auriculella expansa,21317,14,,14,0,1,Maui,West Maui; Waikapu,20.831351,-156.507593,6894
Auriculella expansa,23984,5,,5,0,1,Maui,West Maui; Waikapu,20.831351,-156.507593,6894
Auriculella expansa,21286,64,1,63,0.015625,0.984375,Maui,"West Maui; Waikapu, right branch",20.844186,-156.522013,3620
Auriculella expansa,76699,4,,4,0,1,Maui,West Maui; Waikapu; bottom of valley,20.85675263,-156.5253709,
Auriculella expansa,21275,1,,1,0,1,Maui,West Maui; gulch W of Wainee,20.869571,-156.656139,769
Auriculella expansa,21253,53,1,52,0.018867925,0.981132075,Maui,West Maui; Wainee gulch from entrance - source,20.870088,-156.647425,1002
Auriculella expansa,21254,9,,9,0,1,Maui,West Maui; Wainee gulch from entrance - source,20.870088,-156.647425,1002
Auriculella expansa,23981,55,,55,0,1,Maui,West Maui; Wainee,20.876331,-156.637573,2339
Auriculella expansa,"215633, 215634, 215635",40,0,40,0,1,Maui,West Maui; Iao; (M-4C),20.87831826,-156.5568074,0
Auriculella expansa,48913,108,4,104,0.037037037,0.962962963,Maui,West Maui; Iao; tableland,20.87838939,-156.5567294,
Auriculella expansa,23988,7,,7,0,1,Maui,W W Maui; Iao,20.878398,-156.56084,3212
Auriculella expansa,76511,5,2,3,0.4,0.6,Maui,"West Maui; Iao Valley, ridge S",20.87866972,-156.5482119,
Auriculella expansa,"215647, 215648, 215649, 215650",34,0,34,0,1,Maui,West Maui; Iao Valley; (M-4D),20.87869861,-156.5481802,0
Auriculella expansa,"215596, 215603, 215605",82,0,82,0,1,Maui,West Maui; Iao Valley,20.878824,-156.549622,4557
Auriculella expansa,21348,44,,44,0,1,Maui,West Maui; Iao,20.878824,-156.549622,4557
Auriculella expansa,21349,16,,16,0,1,Maui,West Maui; Iao,20.878824,-156.549622,4557
Auriculella expansa,21350,17,,17,0,1,Maui,West Maui; Iao,20.878824,-156.549622,4557
Auriculella expansa,21351,6,,6,0,1,Maui,West Maui; Iao,20.878824,-156.549622,4557
Auriculella expansa,21352,34,,34,0,1,Maui,West Maui; Iao,20.878824,-156.549622,4557
Auriculella expansa,25048,24,,24,0,1,Maui,West Maui; Iao Valley,20.878824,-156.549622,4557
Auriculella expansa,48892,483,57,426,0.118012422,0.881987578,Maui,West Maui; Iao Valley,20.878824,-156.549622,4557
Auriculella expansa,38880,80,,80,0,1,Maui,"West Maui; Iao; just below 38871, along trail",20.878928,-156.546016,50
Auriculella expansa,46107,22,,22,0,1,Maui,West Maui; Iao Valley; on flat above Needle,20.880541,-156.548613,684
Auriculella expansa,38919,1062,30,1032,0.028248588,0.971751412,Maui,"West Maui; Iao; along trail near stream, main valley just above bridge infront of needle",20.880817,-156.549833,725
Auriculella expansa,17450,14,,14,0,1,Maui,East Maui; Iao Valley,20.881083,-156.543164,1806
Auriculella expansa,"215622, 215625, 215626, 215627",66,1,65,0.015151515,0.984848485,Maui,"West Maui; Iao, Upper; (M-4B)",20.88126931,-156.5536825,0
Auriculella expansa,38964,70,5,65,0.071428571,0.928571429,Maui,"West Maui; Iao; valley in front of needle, between base of needle & bridge",20.881591,-156.548206,228
Auriculella expansa,46111,2,,2,0,1,Maui,"West Maui; E ridge Iao Valley, above Wailuku",20.881866,-156.540467,2542
Auriculella expansa,38890,9,,9,0,1,Maui,"West Maui; Iao; large Kukui clump, above hotel, along road, below needle",20.882269,-156.538337,1781
Auriculella expansa,"76673, 76674, 76675",43,0,43,0,1,Maui,"West Maui; Iao Valley; Black Gorge; along new trail to tunnel, next vel. below Needle, right side going up",20.88245857,-156.5490107,0
Auriculella expansa,76661,1,,1,0,1,Maui,West Maui; Iao Valley; Black Gorge; hillside,20.88254746,-156.5489132,
Auriculella expansa,25050,41,,41,0,1,Maui,West Maui; Wailuku,20.883133,-156.482402,11377
Auriculella expansa,25049,10,1,9,0.1,0.9,Maui,West Maui; Lahaina; Mt. Retreat,20.892777,-156.646163,2405
Auriculella expansa,12956,3,0,3,0,1,Maui,West Maui,20.904766,-156.578181,16177
Auriculella expansa,12958,4,0,4,0,1,Maui,West Maui,20.904766,-156.578181,16177
Auriculella expansa,23980,55,1,54,0.018181818,0.981818182,Maui,West Maui; Hanakaoo; val. W of T2v,20.92225107,-156.6328115,
Auriculella expansa,15854,11,,11,0,1,Maui,West Maui; Waihee,20.926641,-156.547205,4816
Auriculella expansa,21334,5,,5,0,1,Maui,West Maui; Waihee,20.926641,-156.547205,4816
Auriculella expansa,21335,10,1,9,0.1,0.9,Maui,West Maui; Waihee,20.926641,-156.547205,4816
Auriculella expansa,21336,17,,17,0,1,Maui,West Maui; Waihee,20.926641,-156.547205,4816
Auriculella expansa,23985,7,,7,0,1,Maui,West Maui; Waihee,20.926641,-156.547205,4816
Auriculella expansa,23986,13,,13,0,1,Maui,West Maui; Waihee,20.926641,-156.547205,4816
Auriculella expansa,23987,90,,90,0,1,Maui,West Maui; Waihee,20.926641,-156.547205,4816
Auriculella expansa,25046,29,,29,0,1,Maui,West Maui; Waihee,20.926641,-156.547205,4816
Auriculella expansa,48899,8,,8,0,1,Maui,West Maui; Waihee,20.926641,-156.547205,4816
Auriculella expansa,45432,54,0,54,0,1,Maui,"West Maui; Honokahau; bet. headgate & top of ridge, lefthand side of valley leading to Eke trail",20.929739,-156.579099,6706
Auriculella expansa,45388,38,1,37,0.026315789,0.973684211,Maui,West Maui; Honokahau; near stream below head gates,20.930717,-156.584966,11463
Auriculella expansa,"45422, 45423",26,0,26,0,1,Maui,"West Maui; Honokahau; top of trail lefthand side, Eke trail to halfway house",20.931768,-156.578761,3454
Auriculella expansa,45428,9,0,9,0,1,Maui,West Maui; Honokahau; Eke trail top of ridge after leaving headgate homes,20.933587,-156.578584,4855
Auriculella expansa,45409,12,0,12,0,1,Maui,West Maui; Honokahau; between old ditch tunnel & head gates,20.934124,-156.606166,4338
Auriculella expansa,45419,35,0,35,0,1,Maui,West Maui; Honokahau; from headgate to top of ridge left hand side,20.934124,-156.606166,4338
Auriculella expansa,39000,157,1,156,0.006369427,0.993630573,Maui,West Maui; Waihee; site of old camp below intake of upper ditch,20.935239,-156.524854,657
Auriculella expansa,"190144, 190145",10,1,9,0.1,0.9,Maui,West Maui; Honokahau Stream; Haikukiako,20.935383,-156.584206,911
Auriculella expansa,38983,167,3,164,0.017964072,0.982035928,Maui,West Maui; Waihee; just above 2nd crossing,20.942335,-156.530583,2363
Auriculella expansa,"212058, 212059, 212060, 212061, 212062, 212063, 212064, 212065",280,0,280,0,1,Maui,West Maui; Makamakaole,20.95764029,-156.5356069,0
Auriculella expansa,"92473, 92474",4,0,4,0,1,Maui,"West Maui; Kahakuloa, Puu Olelo ridge",20.973674,-156.552141,535
Auriculella expansa,45435,16,0,16,0,1,Maui,West Maui; Honokahau; from new Tunnel hole no. 12 to top of ridge on right hand side. Abt 1 mi below head gate,20.974811,-156.593443,9410
Auriculella flavida,33697,8,2,6,0.25,0.75,Molokai,Kamalo; W valley; above ditch trail,21.056753,-156.884851,
Auriculella flavida,33715,6,5,1,0.833333333,0.166666667,Molokai,Kamalo; W valley; 2nd valley back of 1st colony of 1st colony of redfieldi,21.059697,-156.882051,1995
Auriculella flavida,41763,9,7,2,0.777777778,0.222222222,Molokai,"Kawela; big gulch, bottom & sides just below waterfall",21.07408,-156.94607,
Auriculella flavida,24478,9,6,3,0.666666667,0.333333333,Molokai,Kawela; Kawela mauka; bottom & sides of valley,21.074499,-156.940212,
Auriculella flavida,24445,2,1,1,0.5,0.5,Molokai,Kawela; = on ridge near edge of Kawela (mauka),21.080327,-156.937745,
Auriculella flavida,24321,26,7,19,0.269230769,0.730769231,Molokai,"Puukolekole - Pelekunu; lowest lot, beginning of forest",21.10209,-156.90196,792
Auriculella flavida,41801,1,1,,1,0,Molokai,Kawela; from 41738-41779,21.10297,-156.922865,6287
Auriculella flavida,41581,3,,3,0,1,Molokai,"Kamoku, 2nd ridge & valley N of",21.119077,-156.924327,1115
Auriculella flavida,89199,3,,3,0,1,Molokai,Kaunakakai; Kaunakakai Valley,21.124984,-156.99372,5612
Auriculella flavida,45701,22,9,13,0.409090909,0.590909091,Molokai,Hanalilolilo; 2nd valley N; near & above entrance to tunnel,21.134927,-156.913991,
Auriculella flavida,"89034, 89035",5,1,4,0.2,0.8,Molokai,Kamalo; Ohialele No. I,21.145342,-156.891899,198
Auriculella gagneorum,176456,1,,1,0,1,Oahu,Waianae Mountains; Manuwaikaalai Gulch; Loc. 5 = W470 A-1. SEE MAP,21.396761,-158.090903,73
Auriculella gagneorum,177468,1,,1,0,1,Oahu,Waianae Mountains; Kaaikukai Gulch; above Loc. 2; Loc. 2a,21.403528,-158.081307,2911
Auriculella gagneorum,176973,11,,11,0,1,Oahu,Waianae Mountains; North Kaaikukai; Loc. 3 = W460-2. SEE MAP,21.40840013,-158.0892329,100
Auriculella gagneorum,176916,1,,1,0,1,Oahu,Waianae Mountains; North Kaaikukai Gulch; north branch. Above forest reserve fence; Loc. 2 = W460-1. SEE MAP,21.408999,-158.088272,100
Auriculella gagneorum,33018,27,,27,0,1,Oahu,Waianae Mts.; E; ridge S of Green Peak; head of small valley W of turn W,21.41193333,-158.1030833,
Auriculella gagneorum,24989,37,,37,0,1,Oahu,"Waianae Mts.; Green Peak, E slope of",21.41249999,-158.0989833,
Auriculella gagneorum,174037,1,,1,0,1,Oahu,Waianae Mountains; North Palawai Gulch; Loc. 1 = W451 A-1; See map,21.41338,-158.084063,50
Auriculella gagneorum,38031,3,,3,0,1,Oahu,"Waianae Mts.; Green Peak, peak of",21.413483,-158.101267,
Auriculella gagneorum,59612,79,,79,0,1,Oahu,Waianae Mountains; Green Pk; N. edge of ridge W. of Pk. to 1st ridge,21.41348334,-158.1028667,
Auriculella gagneorum,177217,15,,15,0,1,Oahu,Waianae Mountains; North Palawai; Loc. 11 = W451 A-8. SEE MAP 135076-100,21.413568,-158.092056,50
Auriculella gagneorum,174081,3,,3,0,1,Oahu,Waianae Mountains; Palawai II; along trail in a small side gulch; Loc. 2 = W451 A-f2,21.413709,-158.084885,50
Auriculella gagneorum,174141,2,,2,0,1,Oahu,"Waianae Mountains; Palawai II; above Loc. 2, under a large rock 20 feet above trail; Loc. 2a = W451 A-f2",21.413709,-158.084885,50
Auriculella gagneorum,183862,2,,2,0,1,Oahu,Waianae Mountains; Palawai I>II; Loc. 5 = W451 B-1a. SEE MAP,21.41392,-158.097002,50
Auriculella gagneorum,19891,6,,6,0,1,Oahu,"Waianae Mts.; Green Peak & Palekea, ridge between",21.41408333,-158.1008333,
Auriculella gagneorum,22739,74,,74,0,1,Oahu,Waianae Mts.; Green Peak; 1st gap,21.41596667,-158.0997,
Auriculella gagneorum,33011,44,,44,0,1,Oahu,Waianae Mts.; E; ridge S of Green Peak; from 33002 - bottom of second Sewall's Leap. Loc 5 = W450-8-10-11,21.419253,-158.098307,100
Auriculella gagneorum,177278,9,,9,0,1,Oahu,Waianae Mountains; North Palawai; Loc. 14 = W451-3. SEE MAP 135076-100,21.42028766,-158.0923032,100
Auriculella gagneorum,127221,11,,11,0,1,Oahu,Waianae Mountains; Napepeolelo> W; Loc. 6 = W440 A-2,21.42134048,-158.093034,100
Auriculella gagneorum,184885,2,,2,0,1,Oahu,Waianae Mountains; Pualii; 5 & 6; along new firebreak trail,21.421544,-158.088499,1875
Auriculella gagneorum,"173979, 173980",20,0,20,0,1,Oahu,Waianae Mountains; Near head of Napepeolelo Gulch; Loc. = 126998-127164; Sweeping stored,21.42188333,-158.0935667,
Auriculella gagneorum,216123,5,,5,0,1,Oahu,Waianae; Pualii-Napepeiaolelo Ridge,21.42315,-158.0928333,
Auriculella gagneorum,176766,21,,21,0,1,Oahu,Waianae Mountains; Pualii Gulch; Loc. 9 = W430 B-1. SEE MAP,21.42361878,-158.0826392,100
Auriculella gagneorum,176651,3,,3,0,1,Oahu,Waianae Mountains; Pualii Gulch; Loc. 6 = W430-2. SEE MAP = 135009-011,21.42648891,-158.0849043,100
Auriculella gagneorum,176596,2,,2,0,1,Oahu,Waianae Mountains; Pohakea Gulch; Loc. 4 = W425-1. SEE MAP for #135001-020,21.427453,-158.086909,200
Auriculella gagneorum,211563,5,,5,0,1,Oahu,Waianae Mountains; Ekahanui Gulch; Loc. #3,21.439784,-158.09286,75
Auriculella gagneorum,"211678, 211723",8,0,8,0,1,Oahu,Waianae Mountains; Ekahanui Gulch; Loc. #4,21.439107,-158.095312,75
Auriculella gagneorum,16884,1,,1,0,1,Oahu,"Waianae Mts.; Green Peak, W of; above ieie flat = Loc 450A-1a",,,
Auriculella gagneorum,21823,55,,55,0,1,Oahu,Waianae Mts.; Green Peak; 1st clear space W Green Peak,,,
Auriculella lanaiensis,20041,3,,3,0,1,Lanai,Waiapaa,20.802673,-156.888651,200
Auriculella lanaiensis,"184612, 184613",11,0,11,0,1,Lanai,Waiakeakua; Loc. 1. SEE MAP,20.80354,-156.865971,100
Auriculella lanaiensis,184659,7,,7,0,1,Lanai,Haalelelpaakai; Loc. 7. SEE MAP,20.804765,-156.865017,100
Auriculella lanaiensis,59204,1,,1,0,1,Lanai,Waiakeakua gulch,20.805096,-156.866037,606
Auriculella lanaiensis,59859,8,,8,0,1,Lanai,"Waiakeakua, head of",20.80518,-156.86485,492
Auriculella lanaiensis,59866,8,,8,0,1,Lanai,Puu Kole; from main ridge just N. of Puu Kole,20.807491,-156.871982,453
Auriculella lanaiensis,184622,8,,8,0,1,Lanai,Haalele paakai; Loc. 2. SEE MAP,20.808283,-156.868616,100
Auriculella lanaiensis,184629,11,,11,0,1,Lanai,Lanaihale; Loc. 3. SEE MAP,20.80962,-156.871463,100
Auriculella lanaiensis,184670,2,,2,0,1,Lanai,Haalelelpaakai; Loc. 8. SEE MAP,20.810227,-156.868922,100
Auriculella lanaiensis,"210962, 210963",13,0,13,0,1,Lanai,Lanaihale (summit),20.8122,-156.87331,
Auriculella lanaiensis,184638,2,,2,0,1,Lanai,Ridge between Lanaihale and Haalelelpaakai; Loc. 4. SEE MAP,20.812301,-156.874193,100
Auriculella lanaiensis,20103,10,,10,0,1,Lanai,Kunalo & Lanaihale,20.813163,-156.874061,824
Auriculella lanaiensis,184645,8,,8,0,1,Lanai,Lanaihale; Loc. 5. SEE MAP,20.813666,-156.875068,100
Auriculella lanaiensis,34531,4,,4,0,1,Lanai,"Capt. Soules; top of mountan, 1, Lot 1",20.816024,-156.877518,7033
Auriculella lanaiensis,184655,1,,1,0,1,Lanai,Ridge Northwest of Lanaihale; Loc. 6. SEE MAP,20.816466,-156.876879,100
Auriculella lanaiensis,"216084, 216085, 216090, 216091",18,0,18,0,1,Lanai,Lanaihale,20.818297,-156.880691,4263
Auriculella lanaiensis,20030,6,,6,0,1,Lanai,Lanaihale,20.818297,-156.880691,4263
Auriculella lanaiensis,183690,6,,6,0,1,Lanai,Kaunoku; Puu Aalii; summit forest,20.81875,-156.87783,260
Auriculella lanaiensis,184742,1,,1,0,1,Lanai,Kaiholena Gulch; Loc. 16. SEE MAP,20.824126,-156.892671,100
Auriculella lanaiensis,34238,2,,2,0,1,Lanai,Eastern end; from base camp Capt. Soule's house,20.825551,-156.864608,9318
Auriculella lanaiensis,34254,48,,48,0,1,Lanai,Eastern end; from base camp Capt. Soule's house,20.825551,-156.864608,9318
Auriculella lanaiensis,34269,1,,1,0,1,Lanai,Eastern end; from base camp Capt. Soule's house,20.825551,-156.864608,9318
Auriculella lanaiensis,34293,35,,35,0,1,Lanai,Eastern end; from base camp Capt. Soule's house,20.825551,-156.864608,9318
Auriculella lanaiensis,34435,35,,35,0,1,Lanai,"Kaiholena; ""right hand side, middle of ridge""",20.827336,-156.89851,275
Auriculella lanaiensis,34456,3,,3,0,1,Lanai,"Kaiholena; ""1 day up valley & right hand side",20.8285,-156.900269,275
Auriculella lanaiensis,34503,29,,29,0,1,Lanai,"Kaiholena; ""valley & up left hand side, mostly from valley""",20.829141,-156.897523,275
Auriculella lanaiensis,20011,8,,8,0,1,Lanai,Kaihalena {Kaihalena or Kaiholena?},20.829462,-156.90057,502
Auriculella lanaiensis,20012,4,,4,0,1,Lanai,Kaihalena {Kaihalena or Kaiholena?},20.829462,-156.90057,502
Auriculella lanaiensis,34389,34,,34,0,1,Lanai,"Kaiholena; ""up valley bottom""",20.829462,-156.90057,502
Auriculella lanaiensis,34412,25,,25,0,1,Lanai,"Kaiholena; ""left hand side, top ridge""",20.830505,-156.899926,275
Auriculella lanaiensis,34413,1,,1,0,1,Lanai,"Kaiholena; ""left hand side, top ridge""",20.830505,-156.899926,275
Auriculella lanaiensis,183693,1,,1,0,1,Lanai,Kaiholena Valley,20.832418,-156.905063,459
Auriculella lanaiensis,34130,18,,18,0,1,Lanai,Eastern end; top & ridge from Base Camp Capt. Soules' house,20.83261,-156.859801,8363
Auriculella lanaiensis,34143,42,,42,0,1,Lanai,Eastern end; top & ridge from Base Camp Capt. Soules' house,20.83261,-156.859801,8363
Auriculella lanaiensis,34160,7,,7,0,1,Lanai,Eastern end; top & ridge from Base Camp Capt. Soules' house,20.83261,-156.859801,8363
Auriculella lanaiensis,34186,3,,3,0,1,Lanai,Eastern end; top & ridge from Base Camp Capt. Soules' house,20.83261,-156.859801,8363
Auriculella lanaiensis,"184680, 184681",16,0,16,0,1,Lanai,Head of Hulupoe Gulch; Loc. 9. SEE MAP,20.832685,-156.901272,100
Auriculella lanaiensis,20114,1,,1,0,1,Lanai,Kaihalena,20.838778,-156.91701,
Auriculella lanaiensis,34351,13,,13,0,1,Lanai,from 1-5 gulches beyond house gulch,20.842391,-156.922635,20828
Auriculella lanaiensis,"59939, 59940",4,0,4,0,1,Lanai,Huola; Maunalei; NE side,20.843778,-156.884675,1376
Auriculella lanaiensis,12916,7,,7,0,1,Lanai,Lanai,20.849985,-156.934553,14821
Auriculella lanaiensis,12917,7,,7,0,1,Lanai,Lanai,20.849985,-156.934553,14821
Auriculella lanaiensis,15842,21,,21,0,1,Lanai,Lanai,20.849985,-156.934553,14821
Auriculella lanaiensis,15843,23,,23,0,1,Lanai,Lanai,20.849985,-156.934553,14821
